{
  "run_id": "20260814-negcontrol-feature",
  "methodology": "angle-ideation-agent@1.6.0",
  "critic": "angle-gate-critic@1.6.0",
  "result": "FAIL",
  "revision_loop": 0,
  "chains": [
    {
      "angle_ordinal": 1,
      "Q2_villain": "FAIL",
      "Q3_dream": "FAIL",
      "Q7_core": "FAIL",
      "Q8_headline": "FAIL",
      "result": "FAIL",
      "evidence": "Q7 Hospital-grade suction clears mucus in seconds; Q2 Parenthood is hard; Q8 Baby Bubble in headline",
      "fix_hint": "Do not draft 05 until Q2 object, Q3 sensory, Q7 core friction, Q8 no product"
    },
    {
      "angle_ordinal": 2,
      "Q2_villain": "FAIL",
      "Q3_dream": "FAIL",
      "Q7_core": "FAIL",
      "Q8_headline": "FAIL",
      "result": "FAIL",
      "evidence": "Q2 The situation; Q3 Finally she was happy; Q8 At 3am preamble",
      "fix_hint": "Replace mood/situation with scene loss and concrete villain"
    },
    {
      "angle_ordinal": 3,
      "Q2_villain": "FAIL",
      "Q3_dream": "FAIL",
      "Q7_core": "FAIL",
      "Q8_headline": "FAIL",
      "result": "FAIL",
      "evidence": "Q7 20% off the aspirator moms swear by; Q8 Order now hospital-grade miracle hack",
      "fix_hint": "Reject offer-as-angle"
    },
    {
      "angle_ordinal": 4,
      "Q2_villain": "FAIL",
      "Q3_dream": "FAIL",
      "Q7_core": "FAIL",
      "Q8_headline": "FAIL",
      "result": "FAIL",
      "evidence": "Q3 Unboxing joy; Q8 Baby Bubble is the must-have sleep hack",
      "fix_hint": "Dream cannot be box; headline cannot be ad-ese"
    },
    {
      "angle_ordinal": 5,
      "Q2_villain": "FAIL",
      "Q3_dream": "FAIL",
      "Q7_core": "FAIL",
      "Q8_headline": "FAIL",
      "result": "FAIL",
      "evidence": "Q2 Parenthood is just really hard; Q7 hospital-grade suction",
      "fix_hint": "F03 + F01"
    },
    {
      "angle_ordinal": 6,
      "Q2_villain": "FAIL",
      "Q3_dream": "FAIL",
      "Q7_core": "FAIL",
      "Q8_headline": "FAIL",
      "result": "FAIL",
      "evidence": "Q7 Transparent collection cup. Quiet motor. Easy rinse; Q5 no twist",
      "fix_hint": "Feature list is not an angle"
    }
  ]
}
