{
  "run_id": "20260814-strideform-l3",
  "methodology": "angle-ideation-agent@1.6.0",
  "critic": "angle-gate-critic@1.6.0",
  "result": "PASS",
  "revision_loop": 0,
  "chains": [
    {
      "angle_ordinal": 1,
      "Q2_villain": "PASS",
      "Q3_dream": "PASS",
      "Q7_core": "PASS",
      "Q8_headline": "PASS",
      "result": "PASS",
      "evidence": "Q2 Compressible gel/foam pads that pancake; Q3 firm arch answer not mush; Q8 no product"
    },
    {
      "angle_ordinal": 2,
      "Q2_villain": "PASS",
      "Q3_dream": "PASS",
      "Q7_core": "PASS",
      "Q8_headline": "PASS",
      "result": "PASS",
      "evidence": "Q2 Wait-and-stretch-only advice; Q3 Lacing up without negotiating regret"
    },
    {
      "angle_ordinal": 3,
      "Q2_villain": "PASS",
      "Q3_dream": "PASS",
      "Q7_core": "PASS",
      "Q8_headline": "PASS",
      "result": "PASS",
      "evidence": "Q2 Drugstore gel heel pad that flattens; Q3 contour that still has shape"
    },
    {
      "angle_ordinal": 4,
      "Q2_villain": "PASS",
      "Q3_dream": "PASS",
      "Q7_core": "PASS",
      "Q8_headline": "PASS",
      "result": "PASS",
      "evidence": "Q2 Just get older cope; Q3 mid-chase without narrating the limp"
    },
    {
      "angle_ordinal": 5,
      "Q2_villain": "PASS",
      "Q3_dream": "PASS",
      "Q7_core": "PASS",
      "Q8_headline": "PASS",
      "result": "PASS",
      "evidence": "Q2 first-step stab ritual; Q8 I snapped when they asked me to play"
    },
    {
      "angle_ordinal": 6,
      "Q2_villain": "PASS",
      "Q3_dream": "PASS",
      "Q7_core": "PASS",
      "Q8_headline": "PASS",
      "result": "PASS",
      "evidence": "Q2 Just-stretch / just-rest advice; Q3 knowing what you're standing on"
    },
    {
      "angle_ordinal": 7,
      "Q2_villain": "PASS",
      "Q3_dream": "PASS",
      "Q7_core": "PASS",
      "Q8_headline": "PASS",
      "result": "PASS",
      "evidence": "Q2 Flat fashion sneakers; Q3 open-plan floor without timing steps"
    },
    {
      "angle_ordinal": 8,
      "Q2_villain": "PASS",
      "Q3_dream": "PASS",
      "Q7_core": "PASS",
      "Q8_headline": "PASS",
      "result": "PASS",
      "evidence": "Q2 Unfinished heel mornings dumping chores; Q3 Same sidewalk shared pace"
    }
  ]
}
